230725000	Sporadic cerebral amyloid angiopathy	E85.4	Organ-limited amyloidosis	D016657
23073007	Decerebrate posture	R29.3	Abnormal posture	D003655
230744007	Cerebrospinal fluid leak	G97.0	Cerebrospinal fluid leak from spinal puncture	D065634
230744007	Cerebrospinal fluid leak	G97.82	Other postprocedural complications and disorders of nervous system	D065634
230744007	Cerebrospinal fluid leak	T85.03X?	Leakage of ventricular intracranial (communicating) shunt, episode of care unspecified	D065634
230744007	Cerebrospinal fluid leak	T79.8XX?	Other early complications of trauma, episode of care unspecified	D065634
230746009	Obstructive hydrocephalus	G91.8	Other hydrocephalus	D006849
230746009	Obstructive hydrocephalus	G09	Sequelae of inflammatory diseases of central nervous system	D006849
230755007	Upwards herniation of cerebellum	G93.5	Compression of brain	D004677
230766000	Multicystic encephalomalacia	G93.89	Other specified disorders of brain	D004678
230799003	Post-traumatic coma	P91.5	Neonatal coma	D020207
23132008	AL amyloidosis	E85.89	Other amyloidosis	D000075363
23132008	AL amyloidosis	E85.81	Light chain (AL) amyloidosis	D000075363
231440006	Delirium of mixed origin	F05	Delirium due to known physiological condition	D003693
231477003	Heroin dependence	F11.20	Opioid dependence, uncomplicated	D006556
231479000	Morphine dependence	F11.20	Opioid dependence, uncomplicated	D009021
231480002	Opium dependence	F11.20	Opioid dependence, uncomplicated	D000074607
23171006	Delayed AND/OR secondary postpartum hemorrhage	P01.9	Newborn affected by maternal complication of pregnancy, unspecified	D006473
231854006	Atopic conjunctivitis	H10.11	Acute atopic conjunctivitis, right eye	D003233
231854006	Atopic conjunctivitis	H10.12	Acute atopic conjunctivitis, left eye	D003233
231854006	Atopic conjunctivitis	H10.13	Acute atopic conjunctivitis, bilateral	D003233
231854006	Atopic conjunctivitis	H10.10	Acute atopic conjunctivitis, unspecified eye	D003233
231857004	Giant papillary conjunctivitis	H10.419	Chronic giant papillary conjunctivitis, unspecified eye	D003233
231857004	Giant papillary conjunctivitis	Z97.3	Presence of spectacles and contact lenses	D003233
231861005	Chlamydial conjunctivitis	P39.1	Neonatal conjunctivitis and dacryocystitis	D003235
231861005	Chlamydial conjunctivitis	P39.1	Neonatal conjunctivitis and dacryocystitis	D003235
231861005	Chlamydial conjunctivitis	A71.1	Active stage of trachoma	D003235
231861005	Chlamydial conjunctivitis	A71.0	Initial stage of trachoma	D003235
231861005	Chlamydial conjunctivitis	A71.1	Active stage of trachoma	D003235
231861005	Chlamydial conjunctivitis	A71.1	Active stage of trachoma	D003235
231861005	Chlamydial conjunctivitis	P39.1	Neonatal conjunctivitis and dacryocystitis	D003235
231861005	Chlamydial conjunctivitis	P39.1	Neonatal conjunctivitis and dacryocystitis	D003235
231861005	Chlamydial conjunctivitis	A74.89	Other chlamydial diseases	D003235
231896005	Acanthamoeba keratitis	B60.13	Keratoconjunctivitis due to Acanthamoeba	D015823
231924000	Arcus of cornea	Q13.4	Other congenital corneal malformations	D001112
231924000	Arcus of cornea	H18.419	Arcus senilis, unspecified eye	D001112
231931001	Stromal corneal dystrophy	H18.59	Other hereditary corneal dystrophies	D003317
231939004	Injury of cornea	S05.90X?	Unspecified injury of unspecified eye and orbit, episode of care unspecified	D065306
231964001	Tumor of iris	D49.89	Neoplasm of unspecified behavior of other specified sites	D015811
231986000	Acute retinal necrosis	B02.39	Other herpes zoster eye disease	D015882
231986000	Acute retinal necrosis	H35.89	Other specified retinal disorders	D015882
232003005	Retinal dialysis	H33.049	Retinal detachment with retinal dialysis, unspecified eye	D012167
232006002	Macular hole	H35.349	Macular cyst, hole, or pseudohole, unspecified eye	D012167
232016005	Proliferative vitreoretinopathy	H35.21	Other non-diabetic proliferative retinopathy, right eye	D018630
232016005	Proliferative vitreoretinopathy	H35.22	Other non-diabetic proliferative retinopathy, left eye	D018630
232016005	Proliferative vitreoretinopathy	H35.23	Other non-diabetic proliferative retinopathy, bilateral	D018630
232016005	Proliferative vitreoretinopathy	H35.20	Other non-diabetic proliferative retinopathy, unspecified eye	D018630
232035005	Retinal artery occlusion	H34.10	Central retinal artery occlusion, unspecified eye	D015356
232035005	Retinal artery occlusion	H34.9	Unspecified retinal vascular occlusion	D015356
232049001	Adult vitelliform macular dystrophy	H35.54	Dystrophies primarily involving the retinal pigment epithelium	D057826
232067008	Retinal pigment epithelial detachment	H35.729	Serous detachment of retinal pigment epithelium, unspecified eye	D012163
232079008	Glaucoma suspect	Z05.9	Observation and evaluation of newborn for unspecified suspected condition ruled out	D009798
232079008	Glaucoma suspect	Z03.89	Encounter for observation for other suspected diseases and conditions ruled out	D009798
232079008	Glaucoma suspect	Z05.9	Observation and evaluation of newborn for unspecified suspected condition ruled out	D009798
232079008	Glaucoma suspect	Z03.89	Encounter for observation for other suspected diseases and conditions ruled out	D009798
232086000	Neovascular glaucoma	H40.51X0	Glaucoma secondary to other eye disorders, right eye, stage unspecified	D015355
232086000	Neovascular glaucoma	H40.52X0	Glaucoma secondary to other eye disorders, left eye, stage unspecified	D015355
232086000	Neovascular glaucoma	H40.50X0	Glaucoma secondary to other eye disorders, unspecified eye, stage unspecified	D015355
232086000	Neovascular glaucoma	E11.39	Type 2 diabetes mellitus with other diabetic ophthalmic complication	D015355
232086000	Neovascular glaucoma	H40.53X0	Glaucoma secondary to other eye disorders, bilateral, stage unspecified	D015355
232086000	Neovascular glaucoma	Q28.9	Congenital malformation of circulatory system, unspecified	D015355
232086000	Neovascular glaucoma	I99.9	Unspecified disorder of circulatory system	D015355
232086000	Neovascular glaucoma	H42	Glaucoma in diseases classified elsewhere	D015355
232121005	Afferent pupillary defect	H21.562	Pupillary abnormality, left eye	D011681
232121005	Afferent pupillary defect	H57.09	Other anomalies of pupillary function	D011681
232146005	Internal ophthalmoplegia	H52.519	Internal ophthalmoplegia (complete) (total), unspecified eye	D009886
232147001	Anisometropic amblyopia	H53.029	Refractive amblyopia, unspecified eye	D000550
232209000	Nasal obstruction	P28.89	Other specified respiratory conditions of newborn	D015508
232286009	Syncopal vertigo	H81.8X9	Other disorders of vestibular function, unspecified ear	D013575
232318001	Noise-induced tinnitus	Z77.122	Contact with and (suspected) exposure to noise	D014012
232326009	High frequency deafness	H90.42	Sensorineural hearing loss, unilateral, left ear, with unrestricted hearing on the contralateral side	D006316
232326009	High frequency deafness	H91.90	Unspecified hearing loss, unspecified ear	D006316
23238000	Common variable agammaglobulinemia	D83.2	Common variable immunodeficiency with autoantibodies to B- or T-cells	D017074
23238000	Common variable agammaglobulinemia	D83.1	Common variable immunodeficiency with predominant immunoregulatory T-cell disorders	D017074
23238000	Common variable agammaglobulinemia	D83.2	Common variable immunodeficiency with autoantibodies to B- or T-cells	D017074
232389000	Pott's puffy tumor	M86.8X8	Other osteomyelitis, other site	D059369
232416001	Velopharyngeal incompetence	K13.79	Other lesions of oral mucosa	D014681
232440009	Acquired laryngeal stenosis	J95.5	Postprocedural subglottic stenosis	D007829
232440009	Acquired laryngeal stenosis	P28.89	Other specified respiratory conditions of newborn	D007829
232441008	Congenital vocal cord palsy	J38.00	Paralysis of vocal cords and larynx, unspecified	D014826
232444000	Acquired vocal cord palsy	J38.00	Paralysis of vocal cords and larynx, unspecified	D014826
233604007	Pneumonia	J18.9	Pneumonia, unspecified organism	D011014
233609002	Pneumonia caused by Chlamydiaceae	P23.1	Congenital pneumonia due to Chlamydia	D061387
233609002	Pneumonia caused by Chlamydiaceae	P23.1	Congenital pneumonia due to Chlamydia	D061387
233609002	Pneumonia caused by Chlamydiaceae	P23.1	Congenital pneumonia due to Chlamydia	D061387
233621003	Rickettsial pneumonia	J16.8	Pneumonia due to other specified infectious organisms	D011022
233645004	Tension pneumothorax	J93.0	Spontaneous tension pneumothorax	D011030
233703007	Interstitial lung disease	J84.848	Other interstitial lung diseases of childhood	D017563
233787006	Acquired subglottic stenosis	J95.5	Postprocedural subglottic stenosis	D007829
233787006	Acquired subglottic stenosis	P28.89	Other specified respiratory conditions of newborn	D007829
233788001	Tracheobronchomalacia	Q32.2	Congenital bronchomalacia	D055089
233791001	Bronchial fistula	J86.0	Pyothorax with fistula	D001983
233850007	Infective endocarditis	I33.0	Acute and subacute infective endocarditis	D004696
233850007	Infective endocarditis	B99.9	Unspecified infectious disease	D004696
23387001	Perforation of esophagus	S27.818?	Other injury of esophagus (thoracic part), episode of care unspecified	D004939
233873004	Hypertrophic cardiomyopathy	I42.2	Other hypertrophic cardiomyopathy	D002312
23388006	Visual field scotoma	H53.419	Scotoma involving central area, unspecified eye	D012607
233892002	Ectopic atrial tachycardia	P29.11	Neonatal tachycardia	D013612
233901002	His bundle tachycardia	I97.191	Other postprocedural cardiac functional disturbances following other surgery	D013613
233935004	Pulmonary thromboembolism	I27.82	Chronic pulmonary embolism	D011655
233964008	Internal carotid artery stenosis	I65.21	Occlusion and stenosis of right carotid artery	D016893
233964008	Internal carotid artery stenosis	I63.239	Cerebral infarction due to unspecified occlusion or stenosis of unspecified carotid artery	D016893
233964008	Internal carotid artery stenosis	I65.29	Occlusion and stenosis of unspecified carotid artery	D016893
233970002	Coronary artery stenosis	T82.857?	Stenosis of other cardiac prosthetic devices, implants and grafts, episode of care unspecified	D023921
233984007	Thoracoabdominal aortic aneurysm	I71.5	Thoracoabdominal aortic aneurysm, ruptured	D017545
233984007	Thoracoabdominal aortic aneurysm	I71.6	Thoracoabdominal aortic aneurysm, without rupture	D017545
233985008	Abdominal aortic aneurysm	I71.4	Abdominal aortic aneurysm, without rupture	D017544
233991005	Mycotic aneurysm	I33.0	Acute and subacute infective endocarditis	D000785
234033004	Vibration syndrome	T75.29X?	Other effects of vibration, episode of care unspecified	D053421
234033004	Vibration syndrome	T75.22X?	Traumatic vasospastic syndrome, episode of care unspecified	D053421
234033004	Vibration syndrome	I73.89	Other specified peripheral vascular diseases	D053421
234062003	Pulmonary vein stenosis	I28.8	Other diseases of pulmonary vessels	D000071078
234062003	Pulmonary vein stenosis	I97.89	Other postprocedural complications and disorders of the circulatory system, not elsewhere classified	D000071078
234087005	Disorders of lymph node and lymphatics	I89.9	Noninfective disorder of lymphatic vessels and lymph nodes, unspecified	D008206
234095009	Lymphatic malformation	Q27.9	Congenital malformation of peripheral vascular system, unspecified	D044148
234109007	Lymphocele	I97.89	Other postprocedural complications and disorders of the circulatory system, not elsewhere classified	D008210
234109007	Lymphocele	L04.9	Acute lymphadenitis, unspecified	D008210
234109007	Lymphocele	T86.19	Other complication of kidney transplant	D008210
23412002	Hemopericardium	S26.00X?	Unspecified injury of heart with hemopericardium, episode of care unspecified	D010490
23412002	Hemopericardium	I23.0	Hemopericardium as current complication following acute myocardial infarction	D010490
23412002	Hemopericardium	S26.022?	Major laceration of heart with hemopericardium, episode of care unspecified	D010490
23412002	Hemopericardium	S26.020?	Mild laceration of heart with hemopericardium, episode of care unspecified	D010490
23412002	Hemopericardium	S26.021?	Moderate laceration of heart with hemopericardium, episode of care unspecified	D010490
23412002	Hemopericardium	S26.01X?	Contusion of heart with hemopericardium, episode of care unspecified	D010490
23412002	Hemopericardium	P54.8	Other specified neonatal hemorrhages	D010490
23412002	Hemopericardium	I31.2	Hemopericardium, not elsewhere classified	D010490
234141001	Congenital arteriovenous malformation	Q27.30	Arteriovenous malformation, site unspecified	D001165
234143003	Parkes Weber syndrome	Q27.30	Arteriovenous malformation, site unspecified	D013341
234191002	Vascular graft occlusion	T82.898?	Other specified complication of vascular prosthetic devices, implants and grafts, episode of care unspecified	D006083
234191002	Vascular graft occlusion	T82.898?	Other specified complication of vascular prosthetic devices, implants and grafts, episode of care unspecified	D006083
234191002	Vascular graft occlusion	T82.392?	Other mechanical complication of femoral arterial graft (bypass), episode of care unspecified	D006083
234191002	Vascular graft occlusion	T82.390?	Other mechanical complication of aortic (bifurcation) graft (replacement), episode of care unspecified	D006083
234191002	Vascular graft occlusion	T82.399?	Other mechanical complication of unspecified vascular grafts, episode of care unspecified	D006083
234191002	Vascular graft occlusion	I99.8	Other disorder of circulatory system	D006083
234191002	Vascular graft occlusion	Y71.2	Prosthetic and other implants, materials and accessory cardiovascular devices associated with adverse incidents	D006083
234350007	Neonatal anemia	P55.1	ABO isoimmunization of newborn	D000751
234350007	Neonatal anemia	P57.0	Kernicterus due to isoimmunization	D000751
234350007	Neonatal anemia	P61.2	Anemia of prematurity	D000751
234350007	Neonatal anemia	P61.4	Other congenital anemias, not elsewhere classified	D000751
234422006	Acute intermittent porphyria	E80.21	Acute intermittent (hepatic) porphyria	D017118
234474009	Dense body defect	Z15.89	Genetic susceptibility to other disease	D010981
234506007	Rupture of spleen	B51.0	Plasmodium vivax malaria with rupture of spleen	D013161
234506007	Rupture of spleen	S36.09X?	Other injury of spleen, episode of care unspecified	D013161
234506007	Rupture of spleen	S36.09X?	Other injury of spleen, episode of care unspecified	D013161
234506007	Rupture of spleen	P15.1	Birth injury to spleen	D013161
234506007	Rupture of spleen	S31.609?	Unspecified open wound of abdominal wall, unspecified quadrant with penetration into peritoneal cavity, episode of care unspecified	D013161
234538002	Hyperimmunoglobulin D with periodic fever	D80.8	Other immunodeficiencies with predominantly antibody defects	D054078
234565009	Immunoglobulin hypercatabolism	D89.89	Other specified disorders involving the immune mechanism, not elsewhere classified	D011504
234646005	Graft versus host disease	D89.810	Acute graft-versus-host disease	D006086
234646005	Graft versus host disease	D89.811	Chronic graft-versus-host disease	D006086
234646005	Graft versus host disease	O99.119	Other diseases of the blood and blood-forming organs and certain disorders involving the immune mechanism complicating pregnancy, unspecified trimester	D006086
234646005	Graft versus host disease	T86.09	Other complications of bone marrow transplant	D006086
234646005	Graft versus host disease	T86.09	Other complications of bone marrow transplant	D006086
234646005	Graft versus host disease	T86.19	Other complication of kidney transplant	D006086
234646005	Graft versus host disease	M34.89	Other systemic sclerosis	D006086
234646005	Graft versus host disease	D89.810	Acute graft-versus-host disease	D006086
234646005	Graft versus host disease	D89.811	Chronic graft-versus-host disease	D006086
234646005	Graft versus host disease	D89.811	Chronic graft-versus-host disease	D006086
234646005	Graft versus host disease	D89.811	Chronic graft-versus-host disease	D006086
234646005	Graft versus host disease	D89.811	Chronic graft-versus-host disease	D006086
234948008	Tooth absent	K08.109	Complete loss of teeth, unspecified cause, unspecified class	D009066
234975001	Root caries	K02.7	Dental root caries	D017213
235067001	Oral tuberculosis	A18.83	Tuberculosis of digestive tract organs, not elsewhere classified	D014393
235075007	Tumor of oral cavity	D49.0	Neoplasm of unspecified behavior of digestive system	D009062
235132004	Tumor of salivary gland	D49.0	Neoplasm of unspecified behavior of digestive system	D012468
235231000119100	Osteophyte of bone	M25.773	Osteophyte, unspecified ankle	D054850
235231000119100	Osteophyte of bone	M50.30	Other cervical disc degeneration, unspecified cervical region	D054850
235231000119100	Osteophyte of bone	M51.34	Other intervertebral disc degeneration, thoracic region	D054850
235231000119100	Osteophyte of bone	M51.36	Other intervertebral disc degeneration, lumbar region	D054850
235231000119100	Osteophyte of bone	M25.70	Osteophyte, unspecified joint	D054850
235231000119100	Osteophyte of bone	M25.78	Osteophyte, vertebrae	D054850
235231000119100	Osteophyte of bone	M25.78	Osteophyte, vertebrae	D054850
235231000119100	Osteophyte of bone	M25.78	Osteophyte, vertebrae	D054850
235595009	Gastroesophageal reflux disease	P78.83	Newborn esophageal reflux	D005764
235671002	Gastric fistula	K31.6	Fistula of stomach and duodenum	D005747
235675006	Gastroparesis syndrome	K91.89	Other postprocedural complications and disorders of digestive system	D018589
235675006	Gastroparesis syndrome	E11.43	Type 2 diabetes mellitus with diabetic autonomic (poly)neuropathy	D018589
235675006	Gastroparesis syndrome	E10.43	Type 1 diabetes mellitus with diabetic autonomic (poly)neuropathy	D018589
235679000	Trichobezoar	T18.2XX?	Foreign body in stomach, episode of care unspecified	D001630
235679000	Trichobezoar	T18.3XX?	Foreign body in small intestine, episode of care unspecified	D001630
235679000	Trichobezoar	T18.9XX?	Foreign body of alimentary tract, part unspecified, episode of care unspecified	D001630
235719002	Food intolerance	K90.49	Malabsorption due to intolerance, not elsewhere classified	D000073923
235724004	Acquired short bowel syndrome	K91.2	Postsurgical malabsorption, not elsewhere classified	D012778
235747003	Amebic colitis	A06.0	Acute amebic dysentery	D004404
235747003	Amebic colitis	A06.2	Amebic nondysenteric colitis	D004404
235753003	Microscopic colitis	K52.839	Microscopic colitis, unspecified	D046728
235825006	Pseudo-obstruction of intestine	K59.8	Other specified functional intestinal disorders	D007418
23585005	Disorder of lysosomal enzyme	E88.89	Other specified metabolic disorders	D016464
235875008	Alcoholic hepatitis	K70.10	Alcoholic hepatitis without ascites	D006519
235875008	Alcoholic hepatitis	F10.988	Alcohol use, unspecified with other alcohol-induced disorder	D006519
235876009	Drug-induced hepatitis	K70.10	Alcoholic hepatitis without ascites	D056486
235876009	Drug-induced hepatitis	T42.1X1?	Poisoning by iminostilbenes, accidental (unintentional), episode of care unspecified	D056486
235876009	Drug-induced hepatitis	T50.905?	Adverse effect of unspecified drugs, medicaments and biological substances, episode of care unspecified	D056486
235876009	Drug-induced hepatitis	F10.988	Alcohol use, unspecified with other alcohol-induced disorder	D056486
235876009	Drug-induced hepatitis	K71.0	Toxic liver disease with cholestasis	D056486
235876009	Drug-induced hepatitis	K71.6	Toxic liver disease with hepatitis, not elsewhere classified	D056486
235884008	Fulminant hepatic failure	K72.90	Hepatic failure, unspecified without coma	D017114
235886005	Chronic hepatic failure	K72.10	Chronic hepatic failure without coma	D058625
235889003	Drug-induced chronic hepatitis	T50.905?	Adverse effect of unspecified drugs, medicaments and biological substances, episode of care unspecified	D056487
235889003	Drug-induced chronic hepatitis	K71.6	Toxic liver disease with hepatitis, not elsewhere classified	D056487
235917005	Sclerosing cholangitis	Q84.0	Congenital alopecia	D015209
235919008	Gallstone	K80.20	Calculus of gallbladder without cholecystitis without obstruction	D041761
235978006	Cystic fibrosis of pancreas	E84.8	Cystic fibrosis with other manifestations	D003550
236059003	Traumatic diaphragmatic hernia	S27.808?	Other injury of diaphragm, episode of care unspecified	D006549
236385009	Drash syndrome	N04.8	Nephrotic syndrome with other morphologic changes	D030321
236403004	Focal segmental glomerulosclerosis	N07.1	Hereditary nephropathy, not elsewhere classified with focal and segmental glomerular lesions	D005923
236403004	Focal segmental glomerulosclerosis	N07.1	Hereditary nephropathy, not elsewhere classified with focal and segmental glomerular lesions	D005923
236403004	Focal segmental glomerulosclerosis	N04.1	Nephrotic syndrome with focal and segmental glomerular lesions	D005923
236403004	Focal segmental glomerulosclerosis	T43.595?	Adverse effect of other antipsychotics and neuroleptics, episode of care unspecified	D005923
236407003	IgA nephropathy	N02.8	Recurrent and persistent hematuria with other morphologic changes	D005922
236443009	Medullary sponge kidney	E83.59	Other disorders of calcium metabolism	D007691
236463002	Hyperkalemic renal tubular acidosis	E27.49	Other adrenocortical insufficiency	D006994
236464008	Hyporeninemic hypoaldosteronism	E27.49	Other adrenocortical insufficiency	D006994
236468006	Adult Fanconi syndrome	E72.09	Other disorders of amino-acid transport	D005198
236633002	Bladder muscle dysfunction - overactive	N81.9	Female genital prolapse, unspecified	D053201
236647003	Urethral stenosis	N35.92	Unspecified urethral stricture, female	D014525
236647003	Urethral stenosis	N35.919	Unspecified urethral stricture, male, unspecified site	D014525
236817003	Teratozoospermia	R86.7	Abnormal histological findings in specimens from male genital organs	D000072660
236818008	Globozoospermia	N46.8	Other male infertility	D000072660
23697004	Crush syndrome	T79.5XX?	Traumatic anuria, episode of care unspecified	D003444
23697004	Crush syndrome	T79.5XX?	Traumatic anuria, episode of care unspecified	D007683
237113009	Vaginal vault prolapse	N99.3	Prolapse of vaginal vault after hysterectomy	D056887
237113009	Vaginal vault prolapse	N81.89	Other female genital prolapse	D056887
237130006	Mid-cycle bleeding	N92.3	Ovulation bleeding	D008796
237130006	Mid-cycle bleeding	T83.89X?	Other specified complication of genitourinary prosthetic devices, implants and grafts, episode of care unspecified	D008796
237130006	Mid-cycle bleeding	N93.8	Other specified abnormal uterine and vaginal bleeding	D008796
237143006	Blocked fallopian tube	N97.1	Female infertility of tubal origin	D005184
237266003	Preterm rupture of membranes	O42.919	Preterm premature rupture of membranes, unspecified as to length of time between rupture and onset of labor, unspecified trimester	D005322
237268002	Chorioangioma	D26.7	Other benign neoplasm of other parts of uterus	D006391
237279007	Transient hypertension of pregnancy	O13.9	Gestational [pregnancy-induced] hypertension without significant proteinuria, unspecified trimester	D046110
237292005	Placental insufficiency	O36.5190	Maternal care for known or suspected placental insufficiency, unspecified trimester, not applicable or unspecified	D010927
237444008	Granulomatous mastitis	A18.89	Tuberculosis of other sites	D058890
237444008	Granulomatous mastitis	N61.0	Mastitis without abscess	D058890
237495005	Thyroid nodule	E04.1	Nontoxic single thyroid nodule	D016606
237510004	Iodine-induced hyperthyroidism	T50.8X5?	Adverse effect of diagnostic agents, episode of care unspecified	D006111
237510004	Iodine-induced hyperthyroidism	T38.2X5?	Adverse effect of antithyroid drugs, episode of care unspecified	D006111
237510004	Iodine-induced hyperthyroidism	E05.80	Other thyrotoxicosis without thyrotoxic crisis or storm	D006111
237547004	Familial dysalbuminemic hyperthyroxinemia	E05.80	Other thyrotoxicosis without thyrotoxic crisis or storm	D050010
237559000	Thyroid hormone resistance syndrome	E05.80	Other thyrotoxicosis without thyrotoxic crisis or storm	D018382
237559000	Thyroid hormone resistance syndrome	E07.89	Other specified disorders of thyroid	D018382
237560005	Generalized thyroid hormone resistance	E07.89	Other specified disorders of thyroid	D018382
237570007	Multinodular goiter	E01.1	Iodine-deficiency related multinodular (endemic) goiter	D006044
237570007	Multinodular goiter	E05.20	Thyrotoxicosis with toxic multinodular goiter without thyrotoxic crisis or storm	D006044
237570007	Multinodular goiter	E05.21	Thyrotoxicosis with toxic multinodular goiter with thyrotoxic crisis or storm	D006044
237570007	Multinodular goiter	E04.2	Nontoxic multinodular goiter	D006044
237596009	Tumor of endocrine pancreas	D49.0	Neoplasm of unspecified behavior of digestive system	D007516
237705001	Hypophysitis	O99.350	Diseases of the nervous system complicating pregnancy, unspecified trimester	D000072659
237730003	Hypothalamic overactivity	E23.3	Hypothalamic dysfunction, not elsewhere classified	D007027
237770005	Syndrome of apparent mineralocorticoid excess	E27.8	Other specified disorders of adrenal gland	D043204
237788002	Premature ovarian failure	E89.40	Asymptomatic postprocedural ovarian failure	D016649
237793004	Hyperandrogenization syndrome	E28.1	Androgen excess	D017588
237821001	Hermaphroditism	Q99.1	46, XX true hermaphrodite	D012734
237821001	Hermaphroditism	Q56.0	Hermaphroditism, not elsewhere classified	D012734
237836003	Short stature disorder	R62.52	Short stature (child)	D004392
237897009	Vascular calcification	I99.8	Other disorder of circulatory system	D061205
