59393003	Hidradenitis suppurativa	L05.92	Pilonidal sinus without abscess	D017497
59479006	Mesangiocapillary glomerulonephritis, type II	N07.3	Hereditary nephropathy, not elsewhere classified with diffuse mesangial proliferative glomerulonephritis	D015432
59479006	Mesangiocapillary glomerulonephritis, type II	N07.5	Hereditary nephropathy, not elsewhere classified with diffuse mesangiocapillary glomerulonephritis	D015432
59479006	Mesangiocapillary glomerulonephritis, type II	N05.6	Unspecified nephritic syndrome with dense deposit disease	D015432
59566000	Oligohydramnios	Q60.6	Potter's syndrome	D016104
59566000	Oligohydramnios	O42.90	Premature rupture of membranes, unspecified as to length of time between rupture and onset of labor, unspecified weeks of gestation	D016104
59566000	Oligohydramnios	O41.00X0	Oligohydramnios, unspecified trimester, not applicable or unspecified	D016104
59566000	Oligohydramnios	O41.00X0	Oligohydramnios, unspecified trimester, not applicable or unspecified	D016104
59621000	Essential hypertension	P29.2	Neonatal hypertension	D000075222
5964004	Disorder of rectum	K62.9	Disease of anus and rectum, unspecified	D012002
59770006	Dyslexia	R48.0	Dyslexia and alexia	D004410
59818004	Secondary dentin	K04.3	Abnormal hard tissue formation in pulp	D003809
59857007	Branchial cleft cyst	Q18.2	Other branchial cleft malformations	D001935
59857007	Branchial cleft cyst	Q18.0	Sinus, fistula and cyst of branchial cleft	D001935
59925007	Paracoccidioidomycosis	B41.8	Other forms of paracoccidioidomycosis	D010229
59925007	Paracoccidioidomycosis	B41.8	Other forms of paracoccidioidomycosis	D010229
59925007	Paracoccidioidomycosis	B41.7	Disseminated paracoccidioidomycosis	D010229
59925007	Paracoccidioidomycosis	B41.8	Other forms of paracoccidioidomycosis	D010229
59925007	Paracoccidioidomycosis	B41.8	Other forms of paracoccidioidomycosis	D010229
59925007	Paracoccidioidomycosis	B41.0	Pulmonary paracoccidioidomycosis	D010229
59927004	Hepatic failure	K72.90	Hepatic failure, unspecified without coma	D048550
59927004	Hepatic failure	K72.90	Hepatic failure, unspecified without coma	D017093
60002000	Hypertrophic gastritis	K29.60	Other gastritis without bleeding	D005758
60046008	Pleural effusion	P28.89	Other specified respiratory conditions of newborn	D010996
60086000	Aldosterone deficiency	E27.49	Other adrenocortical insufficiency	D006994
60086000	Aldosterone deficiency	E27.49	Other adrenocortical insufficiency	D006994
60086000	Aldosterone deficiency	E27.49	Other adrenocortical insufficiency	D006994
60217008	Hemolytic jaundice	P58.9	Neonatal jaundice due to excessive hemolysis, unspecified	D007565
60217008	Hemolytic jaundice	P55.8	Other hemolytic diseases of newborn	D007565
60234000	Aortic valve regurgitation	I35.1	Nonrheumatic aortic (valve) insufficiency	D001022
60318001	Duane's syndrome	H50.89	Other specified strabismus	D004370
60318001	Duane's syndrome	Q67.5	Congenital deformity of spine	D004370
60332004	Malposition of eyelashes	H02.056	Trichiasis without entropion left eye, unspecified eyelid	D058457
60332004	Malposition of eyelashes	H02.053	Trichiasis without entropion right eye, unspecified eyelid	D058457
60332004	Malposition of eyelashes	H02.059	Trichiasis without entropion unspecified eye, unspecified eyelid	D058457
60332004	Malposition of eyelashes	H02.053	Trichiasis without entropion right eye, unspecified eyelid	D058457
60342002	Movement disorder	G25.9	Extrapyramidal and movement disorder, unspecified	D009069
60380001	Narcolepsy	G47.429	Narcolepsy in conditions classified elsewhere without cataplexy	D009290
60380001	Narcolepsy	G47.421	Narcolepsy in conditions classified elsewhere with cataplexy	D009290
60380001	Narcolepsy	G47.429	Narcolepsy in conditions classified elsewhere without cataplexy	D009290
60404007	Cerebral abscess	G06.0	Intracranial abscess and granuloma	D001922
6042001	Pulmonary aspergillosis	B44.1	Other pulmonary aspergillosis	D055732
60525009	Lateral plantar neuropathy	S94.00X?	Injury of lateral plantar nerve, unspecified leg, episode of care unspecified	D020429
60525009	Lateral plantar neuropathy	G57.60	Lesion of plantar nerve, unspecified lower limb	D020429
60555002	Hypersensitivity angiitis	I67.7	Cerebral arteritis, not elsewhere classified	D018366
60573004	Aortic valve stenosis	I35.0	Nonrheumatic aortic (valve) stenosis	D001024
60627008	Obturator hernia	K45.0	Other specified abdominal hernia with obstruction, without gangrene	D006553
60627008	Obturator hernia	K45.1	Other specified abdominal hernia with gangrene	D006553
60627008	Obturator hernia	K45.0	Other specified abdominal hernia with obstruction, without gangrene	D006553
60627008	Obturator hernia	K45.8	Other specified abdominal hernia without obstruction or gangrene	D006553
60684003	SAPHO syndrome	M65.9	Synovitis and tenosynovitis, unspecified	D020083
60684003	SAPHO syndrome	M85.9	Disorder of bone density and structure, unspecified	D020083
60737008	Iron overload	R79.0	Abnormal level of blood mineral	D019190
6077001	Foot-drop	M21.372	Foot drop, left foot	D020427
6077001	Foot-drop	M21.372	Foot drop, left foot	D020427
6077001	Foot-drop	M21.371	Foot drop, right foot	D020427
6077001	Foot-drop	M21.379	Foot drop, unspecified foot	D020427
6077001	Foot-drop	M21.371	Foot drop, right foot	D020427
60844005	Genetic inversion	R89.8	Other abnormal findings in specimens from other organs, systems and tissues	D007446
60876000	Gardner syndrome	D12.6	Benign neoplasm of colon, unspecified	D005736
609302002	Pericardial cyst	Q24.8	Other specified congenital malformations of heart	D008476
609302002	Pericardial cyst	Q24.8	Other specified congenital malformations of heart	D008476
609302002	Pericardial cyst	I31.8	Other specified diseases of pericardium	D008476
609519004	Gestational trophoblastic neoplasia	O43.899	Other placental disorders, unspecified trimester	D031901
609525000	Miscarriage of tubal ectopic pregnancy	O00.109	Unspecified tubal pregnancy without intrauterine pregnancy	D000022
609558009	Essential tremor	L67.1	Variations in hair color	D020329
609559001	Hereditary essential tremor	L67.1	Variations in hair color	D020329
609590004	Radial nerve entrapment	G56.31	Lesion of radial nerve, right upper limb	D020425
609590004	Radial nerve entrapment	G56.32	Lesion of radial nerve, left upper limb	D020425
609590004	Radial nerve entrapment	G56.30	Lesion of radial nerve, unspecified upper limb	D020425
6096002	Breech presentation	O32.8XX0	Maternal care for other malpresentation of fetus, not applicable or unspecified	D001946
6096002	Breech presentation	O32.8XX0	Maternal care for other malpresentation of fetus, not applicable or unspecified	D001946
6096002	Breech presentation	O32.1XX0	Maternal care for breech presentation, not applicable or unspecified	D001946
609613006	Entrapment of common peroneal nerve	G57.32	Lesion of lateral popliteal nerve, left lower limb	D020427
609613006	Entrapment of common peroneal nerve	G57.31	Lesion of lateral popliteal nerve, right lower limb	D020427
609613006	Entrapment of common peroneal nerve	G57.30	Lesion of lateral popliteal nerve, unspecified lower limb	D020427
60979006	Schistosoma haematobium infection	J16.8	Pneumonia due to other specified infectious organisms	D012553
60979006	Schistosoma haematobium infection	N29	Other disorders of kidney and ureter in diseases classified elsewhere	D012553
60979006	Schistosoma haematobium infection	G05.3	Encephalitis and encephalomyelitis in diseases classified elsewhere	D012553
61018003	Fistula of skin	L98.8	Other specified disorders of the skin and subcutaneous tissue	D017577
61031008	Hypocapnia	R79.81	Abnormal blood-gas level	D016857
61199005	Elementary hallucination	R44.2	Other hallucinations	D006212
6121001	Focal epithelial hyperplasia of mouth	K13.29	Other disturbances of oral epithelium, including tongue	D017573
61233003	Silo-fillers' disease	T65.91X?	Toxic effect of unspecified substance, accidental (unintentional), episode of care unspecified	D012832
61233003	Silo-fillers' disease	J70.9	Respiratory conditions due to unspecified external agent	D012832
61253004	Erosion of cervix	N86	Erosion and ectropion of cervix uteri	D002579
61267008	Retinal neovascularization	H47.399	Other disorders of optic disc, unspecified eye	D015861
61267008	Retinal neovascularization	H31.8	Other specified disorders of choroid	D015861
61267008	Retinal neovascularization	H35.051	Retinal neovascularization, unspecified, right eye	D015861
61267008	Retinal neovascularization	H35.059	Retinal neovascularization, unspecified, unspecified eye	D015861
61274003	Opportunistic infectious disease	B48.8	Other specified mycoses	D009894
61274003	Opportunistic infectious disease	B99.9	Unspecified infectious disease	D009894
61277005	Accelerated idioventricular rhythm	I44.2	Atrioventricular block, complete	D016170
61288004	Poisoning by venomous snake	T63.191?	Toxic effect of venom of other reptiles, accidental (unintentional), episode of care unspecified	D012909
61373006	Bacteriuria	O23.40	Unspecified infection of urinary tract in pregnancy, unspecified trimester	D001437
61373006	Bacteriuria	Z37.9	Outcome of delivery, unspecified	D001437
61373006	Bacteriuria	Z37.9	Outcome of delivery, unspecified	D001437
61373006	Bacteriuria	O90.9	Complication of the puerperium, unspecified	D001437
61373006	Bacteriuria	O90.9	Complication of the puerperium, unspecified	D001437
61564002	Typhlitis	A42.1	Abdominal actinomycosis	D053706
61564002	Typhlitis	K52.89	Other specified noninfective gastroenteritis and colitis	D053706
61564002	Typhlitis	K57.32	Diverticulitis of large intestine without perforation or abscess without bleeding	D053706
61564002	Typhlitis	K52.89	Other specified noninfective gastroenteritis and colitis	D053706
61564002	Typhlitis	K65.8	Other peritonitis	D053706
61599003	Phlebitis	I80.9	Phlebitis and thrombophlebitis of unspecified site	D010689
61738006	Non-gluten sensitive enteropathy syndrome	K63.89	Other specified diseases of intestine	D064068
61750000	Infection by Angiostrongylus	B81.3	Intestinal angiostrongyliasis	D017206
61750000	Infection by Angiostrongylus	B83.2	Angiostrongyliasis due to Parastrongylus cantonensis	D017206
61758007	Exstrophy of bladder sequence	Q64.12	Cloacal exstrophy of urinary bladder	D001746
61778004	Tumoral calcinosis	L94.2	Calcinosis cutis	D002114
61804006	Alveolitis of jaw	K12.2	Cellulitis and abscess of mouth	D004368
61819007	Rachischisis	Q05.4	Unspecified spina bifida with hydrocephalus	D016135
61830005	Sphenopalatine neuralgia	G90.09	Other idiopathic peripheral autonomic neuropathy	D005156
61917005	Bitemporal hemianopia	H53.47	Heteronymous bilateral field defects	D006423
61927004	Auditory seizure	G40.89	Other seizures	D012640
61947007	Deaf mutism	H91.3	Deaf nonspeaking, not elsewhere classified	D003638
61947007	Deaf mutism	H36	Retinal disorders in diseases classified elsewhere	D003638
61960001	Lordosis deformity of spine	M40.50	Lordosis, unspecified, site unspecified	D008141
61974008	Epidural abscess	G06.0	Intracranial abscess and granuloma	D020802
61974008	Epidural abscess	A17.81	Tuberculoma of brain and spinal cord	D020802
61974008	Epidural abscess	G06.1	Intraspinal abscess and granuloma	D020802
61974008	Epidural abscess	G06.2	Extradural and subdural abscess, unspecified	D020802
61977001	Chronic type B viral hepatitis	B18.0	Chronic viral hepatitis B with delta-agent	D019694
62014003	Adverse reaction to drug	T50.905?	Adverse effect of unspecified drugs, medicaments and biological substances, episode of care unspecified	D064420
6204001	Juvenile myoclonic epilepsy	G40.B09	Juvenile myoclonic epilepsy, not intractable, without status epilepticus	D020190
6204001	Juvenile myoclonic epilepsy	G40.B19	Juvenile myoclonic epilepsy, intractable, without status epilepticus	D020190
6204001	Juvenile myoclonic epilepsy	G40.B11	Juvenile myoclonic epilepsy, intractable, with status epilepticus	D020190
6204001	Juvenile myoclonic epilepsy	G40.309	Generalized idiopathic epilepsy and epileptic syndromes, not intractable, without status epilepticus	D020190
6208003	Clonic seizure	G40.419	Other generalized epilepsy and epileptic syndromes, intractable, without status epilepticus	D012640
6208003	Clonic seizure	G40.409	Other generalized epilepsy and epileptic syndromes, not intractable, without status epilepticus	D012640
6208003	Clonic seizure	G40.309	Generalized idiopathic epilepsy and epileptic syndromes, not intractable, without status epilepticus	D012640
62210001	Inorganic arsenic poisoning	T57.0X1?	Toxic effect of arsenic and its compounds, accidental (unintentional), episode of care unspecified	D020261
62250003	Arachnodactyly	Q68.1	Congenital deformity of finger(s) and hand	D054119
62250003	Arachnodactyly	Q87.43	Marfan's syndrome with skeletal manifestation	D054119
62250003	Arachnodactyly	Q87.5	Other congenital malformation syndromes with other skeletal changes	D054119
62250003	Arachnodactyly	Q74.8	Other specified congenital malformations of limb(s)	D054119
62250003	Arachnodactyly	Q74.8	Other specified congenital malformations of limb(s)	D054119
62250003	Arachnodactyly	Q74.8	Other specified congenital malformations of limb(s)	D054119
62250003	Arachnodactyly	Q52.9	Congenital malformation of female genitalia, unspecified	D054119
62250003	Arachnodactyly	Q55.9	Congenital malformation of male genital organ, unspecified	D054119
62305002	Disorder of language	F80.89	Other developmental disorders of speech and language	D007806
62305002	Disorder of language	F80.89	Other developmental disorders of speech and language	D007806
62315008	Diarrhea	P78.3	Noninfective neonatal diarrhea	D003967
62334008	Athetotic gait	R26.89	Other abnormalities of gait and mobility	D020233
62371005	Pulmonary siderosis	T56.894?	Toxic effect of other metals, undetermined, episode of care unspecified	D012806
62371005	Pulmonary siderosis	J63.6	Pneumoconiosis due to other specified inorganic dusts	D012806
62479008	AIDS	O98.72	Human immunodeficiency virus [HIV] disease complicating childbirth	D000163
62588002	Amelia	Q71.00	Congenital complete absence of unspecified upper limb	D004480
62588002	Amelia	Q72.00	Congenital complete absence of unspecified lower limb	D004480
62588002	Amelia	Q71.899	Other reduction defects of unspecified upper limb	D004480
62588002	Amelia	Q71.03	Congenital complete absence of upper limb, bilateral	D004480
62588002	Amelia	Q72.01	Congenital complete absence of right lower limb	D004480
62588002	Amelia	Q72.03	Congenital complete absence of lower limb, bilateral	D004480
62588002	Amelia	Q71.00	Congenital complete absence of unspecified upper limb	D004480
62588002	Amelia	Q72.00	Congenital complete absence of unspecified lower limb	D004480
626004	Hypercortisolism due to nonpituitary tumor	E24.8	Other Cushing's syndrome	D000182
626004	Hypercortisolism due to nonpituitary tumor	D49.9	Neoplasm of unspecified behavior of unspecified site	D000182
62676009	Falciparum malaria	B50.8	Other severe and complicated Plasmodium falciparum malaria	D016778
62676009	Falciparum malaria	B50.8	Other severe and complicated Plasmodium falciparum malaria	D016778
62730001	Female proctocele without uterine prolapse	O34.80	Maternal care for other abnormalities of pelvic organs, unspecified trimester	D020047
6273006	Priapism	Q55.69	Other congenital malformation of penis	D011317
6273006	Priapism	N48.33	Priapism, drug-induced	D011317
6273006	Priapism	S39.94X?	Unspecified injury of external genitals, episode of care unspecified	D011317
6273006	Priapism	N48.39	Other priapism	D011317
6273006	Priapism	N48.39	Other priapism	D011317
6273006	Priapism	N48.39	Other priapism	D011317
6273006	Priapism	N48.32	Priapism due to disease classified elsewhere	D011317
6273006	Priapism	T50.905?	Adverse effect of unspecified drugs, medicaments and biological substances, episode of care unspecified	D011317
6273006	Priapism	N48.31	Priapism due to trauma	D011317
6285003	Tachyarrhythmia	P29.11	Neonatal tachycardia	D013610
62851005	Impaction of intestine	P76.8	Other specified intestinal obstruction of newborn	D005244
62851005	Impaction of intestine	K56.699	Other intestinal obstruction unspecified as to partial versus complete obstruction	D005244
62851005	Impaction of intestine	K56.49	Other impaction of intestine	D005244
62851005	Impaction of intestine	K56.49	Other impaction of intestine	D005244
62851005	Impaction of intestine	T18.4XX?	Foreign body in colon, episode of care unspecified	D005244
62878007	Atrophy of gums	K06.020	Generalized gingival recession, unspecified	D005889
62909004	Ectropion	H02.139	Senile ectropion of unspecified eye, unspecified eyelid	D004483
62964007	Antley-Bixler syndrome	Q87.5	Other congenital malformation syndromes with other skeletal changes	D054882
62994001	Tracheitis	J04.10	Acute tracheitis without obstruction	D014136
63042009	Congenital atresia of tricuspid valve	Q22.4	Congenital tricuspid stenosis	D018785
63135006	Amyotonia congenita	G70.2	Congenital and developmental myasthenia	D009468
63251006	Persistent miosis	T50.905?	Adverse effect of unspecified drugs, medicaments and biological substances, episode of care unspecified	D015877
63251006	Persistent miosis	T50.905?	Adverse effect of unspecified drugs, medicaments and biological substances, episode of care unspecified	D015877
63339007	Disorder of uterine cervix	N88.9	Noninflammatory disorder of cervix uteri, unspecified	D002577
63363004	Superior vena cava syndrome	I87.1	Compression of vein	D013479
63365006	Madelung's neck	E88.89	Other specified metabolic disorders	D008069
63398001	Bacterial infection due to Pseudomonas	A49.8	Other bacterial infections of unspecified site	D011552
63402005	Meigs' syndrome	D27.9	Benign neoplasm of unspecified ovary	D008539
63402005	Meigs' syndrome	J91.8	Pleural effusion in other conditions classified elsewhere	D008539
63593006	Supraventricular premature beats	I49.2	Junctional premature depolarization	D018880
63627007	Spinal epidural abscess	G06.1	Intraspinal abscess and granuloma	D020802
63650001	Cholera	A00.1	Cholera due to Vibrio cholerae 01, biovar eltor	D002771
63739005	Coronary occlusion	I25.82	Chronic total occlusion of coronary artery	D054059
63739005	Coronary occlusion	I21.9	Acute myocardial infarction, unspecified	D054059
63739005	Coronary occlusion	T82.898?	Other specified complication of vascular prosthetic devices, implants and grafts, episode of care unspecified	D054059
63739005	Coronary occlusion	D49.9	Neoplasm of unspecified behavior of unspecified site	D054059
63739005	Coronary occlusion	I24.0	Acute coronary thrombosis not resulting in myocardial infarction	D054059
63739005	Coronary occlusion	I24.0	Acute coronary thrombosis not resulting in myocardial infarction	D054059
63739005	Coronary occlusion	I24.0	Acute coronary thrombosis not resulting in myocardial infarction	D054059
63783001	Brachygnathism	M26.09	Other specified anomalies of jaw size	D057887
6383007	Premature labor	O60.12X0	Preterm labor second trimester with preterm delivery second trimester, not applicable or unspecified	D007752
6383007	Premature labor	O60.14X0	Preterm labor third trimester with preterm delivery third trimester, not applicable or unspecified	D007752
6383007	Premature labor	O60.10X0	Preterm labor with preterm delivery, unspecified trimester, not applicable or unspecified	D007752
6383007	Premature labor	O60.20X0	Term delivery with preterm labor, unspecified trimester, not applicable or unspecified	D007752
6383007	Premature labor	O60.00	Preterm labor without delivery, unspecified trimester	D007752
6383007	Premature labor	Z37.9	Outcome of delivery, unspecified	D007752
6400008	Xanthoma of eyelid	H02.60	Xanthelasma of unspecified eye, unspecified eyelid	D014973
640003	Injury of pneumogastric nerve	S04.899?	Injury of other cranial nerves, unspecified side, episode of care unspecified	D061223
64031009	Masochistic behavior	R46.89	Other symptoms and signs involving appearance and behavior	D008398
64121000	Peptic ulcer with hemorrhage	P78.82	Peptic ulcer of newborn	D010438
64121000	Peptic ulcer with hemorrhage	K27.4	Chronic or unspecified peptic ulcer, site unspecified, with hemorrhage	D010438
64146000	Progressive pigmentary dermatosis of Schamberg	L81.7	Pigmented purpuric dermatosis	D010859
64156001	Thrombophlebitis	I80.9	Phlebitis and thrombophlebitis of unspecified site	D013924
64169002	Traumatic shock	T79.4XX?	Traumatic shock, episode of care unspecified	D012774
64226004	Colitis	P77.9	Necrotizing enterocolitis in newborn, unspecified	D003092
64250002	Fusarium infection	B36.8	Other specified superficial mycoses	D060585
64250002	Fusarium infection	B48.8	Other specified mycoses	D060585
64250002	Fusarium infection	H16.8	Other keratitis	D060585
64418005	Paracentral scotoma	H53.419	Scotoma involving central area, unspecified eye	D012607
64518008	Paratrigeminal syndrome	G50.8	Other disorders of trigeminal nerve	D020433
64518008	Paratrigeminal syndrome	G50.8	Other disorders of trigeminal nerve	D020433
64581007	Postoperative nausea	R11.2	Nausea with vomiting, unspecified	D020250
64581007	Postoperative nausea	T81.89X?	Other complications of procedures, not elsewhere classified, episode of care unspecified	D020250
64581007	Postoperative nausea	Z98.890	Other specified postprocedural states	D020250
64586002	Carotid artery stenosis	I65.29	Occlusion and stenosis of unspecified carotid artery	D016893
64613007	Enteritis of small intestine	K50.00	Crohn's disease of small intestine without complications	D004751
64634000	Corneal opacity	H17.9	Unspecified corneal scar and opacity	D065306
64634000	Corneal opacity	H17.9	Unspecified corneal scar and opacity	D003318
64635004	Congenital nystagmus	H55.02	Latent nystagmus	D020417
64635004	Congenital nystagmus	R29.818	Other symptoms and signs involving the nervous system	D020417
64667001	Interstitial pneumonia	J84.848	Other interstitial lung diseases of childhood	D017563
64764001	Acute paralytic poliomyelitis, bulbar	A80.39	Other acute paralytic poliomyelitis	D011052
64764001	Acute paralytic poliomyelitis, bulbar	A80.39	Other acute paralytic poliomyelitis	D011052
64764001	Acute paralytic poliomyelitis, bulbar	A80.30	Acute paralytic poliomyelitis, unspecified	D011052
64766004	Ulcerative colitis	K51.90	Ulcerative colitis, unspecified, without complications	D003093
64779008	Blood coagulation disorder	P61.6	Other transient neonatal disorders of coagulation	D001778
64969001	Partial congenital absence of teeth	G37.9	Demyelinating disease of central nervous system, unspecified	D000848
64969001	Partial congenital absence of teeth	Q84.6	Other congenital malformations of nails	D000848
64969001	Partial congenital absence of teeth	Q16.3	Congenital malformation of ear ossicles	D000848
64969001	Partial congenital absence of teeth	Q84.0	Congenital alopecia	D000848
64996003	Intermenstrual bleeding - irregular	T83.89X?	Other specified complication of genitourinary prosthetic devices, implants and grafts, episode of care unspecified	D008796
64996003	Intermenstrual bleeding - irregular	N93.8	Other specified abnormal uterine and vaginal bleeding	D008796
65093003	Disease due to Orthomyxoviridae	B97.89	Other viral agents as the cause of diseases classified elsewhere	D009976
651000146102	Middle East respiratory syndrome	J98.8	Other specified respiratory disorders	D018352
651000146102	Middle East respiratory syndrome	B97.29	Other coronavirus as the cause of diseases classified elsewhere	D018352
65120008	Generalized convulsive epilepsy	G40.301	Generalized idiopathic epilepsy and epileptic syndromes, not intractable, with status epilepticus	D004829
65120008	Generalized convulsive epilepsy	G40.319	Generalized idiopathic epilepsy and epileptic syndromes, intractable, without status epilepticus	D004829
65120008	Generalized convulsive epilepsy	G40.409	Other generalized epilepsy and epileptic syndromes, not intractable, without status epilepticus	D004829
65120008	Generalized convulsive epilepsy	G40.411	Other generalized epilepsy and epileptic syndromes, intractable, with status epilepticus	D004829
65120008	Generalized convulsive epilepsy	G40.401	Other generalized epilepsy and epileptic syndromes, not intractable, with status epilepticus	D004829
65120008	Generalized convulsive epilepsy	G40.309	Generalized idiopathic epilepsy and epileptic syndromes, not intractable, without status epilepticus	D004829
65154009	Infection due to Clostridium perfringens	B96.7	Clostridium perfringens [C. perfringens] as the cause of diseases classified elsewhere	D003015
65154009	Infection due to Clostridium perfringens	B96.7	Clostridium perfringens [C. perfringens] as the cause of diseases classified elsewhere	D003015
65154009	Infection due to Clostridium perfringens	B96.7	Clostridium perfringens [C. perfringens] as the cause of diseases classified elsewhere	D003015
65154009	Infection due to Clostridium perfringens	B96.7	Clostridium perfringens [C. perfringens] as the cause of diseases classified elsewhere	D003015
65154009	Infection due to Clostridium perfringens	A41.4	Sepsis due to anaerobes	D003015
65194006	Night blindness	H53.63	Congenital night blindness	D014786
65194006	Night blindness	H53.61	Abnormal dark adaptation curve	D014786
65194006	Night blindness	H53.62	Acquired night blindness	D014786
65194006	Night blindness	E50.5	Vitamin A deficiency with night blindness	D014786
65194006	Night blindness	H53.63	Congenital night blindness	D009755
65194006	Night blindness	H53.61	Abnormal dark adaptation curve	D009755
65194006	Night blindness	H53.62	Acquired night blindness	D009755
65194006	Night blindness	E50.5	Vitamin A deficiency with night blindness	D009755
6525002	Dependent drug abuse	F19.20	Other psychoactive substance dependence, uncomplicated	D019966
65323003	Polymyalgia rheumatica	M31.5	Giant cell arteritis with polymyalgia rheumatica	D011111
65389002	Adrenoleukodystrophy	E71.528	Other X-linked adrenoleukodystrophy	D000326
